{"delta":null,"hash":"2e25c29eba20d7f7eeaf2e729f1f868111c957c9","metric":41.7740039233905,"run":0,"short_hash":"2e25c29","status":"baseline","summary":"Baseline raw_gru bs4096 snapshot at remote 4060 commit 2e25c29: checkpoint out/models/raw_gru_random_square_chirp_bs4096_snapshot.pt; summary out/predictions/raw_gru_random_square_chirp_bs4096_snapshot_model_multistep/melon_summary.csv; simerr pos=2.363310, vel=9.201048, rot=5.205946, omega=25.003700.","timestamp":"2026-06-06T13:03:24.919116+00:00"}
{"delta":-0.7745422255905012,"hash":"6a417cd9d31b9f6e790f4d0c5d95daf510958872","metric":40.9994616978,"run":1,"short_hash":"6a417cd","status":"baseline","summary":"Clean raw_gru baseline at commit 6a417cd on remote 4060: checkpoint out/models/raw_gru_random_square_chirp_clean_base_6a417cd_bs4096_20260606_210604.pt; summary out/predictions/raw_gru_random_square_chirp_clean_base_6a417cd_bs4096_20260606_210604_model_multistep/melon_summary.csv; melon_simerr_sum=40.9994616978; simerr pos=2.368558406829834, vel=9.130295753479004, rot=5.059418725207016, omega=24.44118881225586; h1/h10/h50 pos=0.0015602990752086043/0.016710815951228142/0.10649651288986206, vel=0.008610310032963753/0.058574553579092026/0.46212896704673767, rot=0.001849144032047164/0.03154538016858199/0.17926424775473632, omega=0.08959975093603134/0.4375995993614197/0.5202474594116211.","timestamp":"2026-06-06T17:12:49.557138+00:00"}
{"delta":-0.09477935009999783,"hash":"91e992b16cbbe2de8c5dceabfb93478dab0298f5","metric":40.9046823477,"run":2,"short_hash":"91e992b","status":"kept","summary":"Experiment #1 kept: DIEN-style causal hidden attention in models/models_gru.py, code commit 5e44fd3, eval head 91e992b on remote 4060. Train/eval suffix attn_5e44fd3_head_91e992b_bs4096_20260607_011406, checkpoint out/models/raw_gru_random_square_chirp_attn_5e44fd3_head_91e992b_bs4096_20260607_011406.pt, summary out/predictions/raw_gru_random_square_chirp_attn_5e44fd3_head_91e992b_bs4096_20260607_011406_model_multistep/melon_summary.csv. melon_simerr_sum=40.9046823477 vs clean baseline 40.9994616978; simerr pos=2.382826089859009, vel=9.14366626739502, rot=5.095562884723224, omega=24.28262710571289; h1/h10/h50 pos=0.0015761035028845/0.0168250668793916/0.106948472559452, vel=0.0086228037253022/0.0585364960134029/0.4629661738872528, rot=0.0019454209479711/0.032221858816654/0.1801564254830042, omega=0.0892055705189704/0.435977041721344/0.509469211101532.","timestamp":"2026-06-06T20:39:09.725469+00:00"}
{"delta":1.1859904653999962,"hash":"f27735a0c7874eecb8eda583bc922bc69caea44c","metric":42.0906728131,"run":3,"short_hash":"f27735a","status":"discarded","summary":"Experiment #2 discarded: parameter-only residual hidden_dim 64->96 on kept attention model, marker commit f27735a, remote 4060. Train/eval suffix attn_hd96_f27735a_bs4096_20260607_044006, checkpoint out/models/raw_gru_random_square_chirp_attn_hd96_f27735a_bs4096_20260607_044006.pt, summary out/predictions/raw_gru_random_square_chirp_attn_hd96_f27735a_bs4096_20260607_044006_model_multistep/melon_summary.csv. melon_simerr_sum=42.0906728131 vs current best 40.9046823477; discarded. simerr pos=2.4538254737854004, vel=9.15630340576172, rot=4.5774105412270805, omega=25.903133392333984; h1/h10/h50 pos=0.0015536289429292/0.0160098280757665/0.1162672564387321, vel=0.0082297017797827/0.0587126947939395/0.4587521553039551, rot=0.0011642435758908/0.0222055235102164/0.1839047191168191, omega=0.087246224284172/0.4263204932212829/0.6355117559432983.","timestamp":"2026-06-07T00:39:20.884353+00:00"}
{"delta":8.863676138799995,"hash":"9b01124094a873faf15e343587e2148b5c5f305d","metric":49.7683584865,"run":4,"short_hash":"9b01124","status":"discarded","summary":"Experiment #3 early-discarded: parameter-only residual hidden_dim 64->32 on kept attention model, marker commit 9b01124, remote 4060. Training was early-stopped around epoch 343 because best valid loss was about 0.003608, far worse than current best attention final valid 0.001832, then current best checkpoint was evaluated on melon. Train/eval suffix attn_hd32_9b01124_bs4096_20260607_084157, checkpoint out/models/raw_gru_random_square_chirp_attn_hd32_9b01124_bs4096_20260607_084157.pt, summary out/predictions/raw_gru_random_square_chirp_attn_hd32_9b01124_bs4096_20260607_084157_model_multistep/melon_summary.csv. melon_simerr_sum=49.7683584865 vs current best 40.9046823477; discarded. simerr pos=2.4100358486175537, vel=11.665486335754396, rot=6.240018385246462, omega=29.45281791687012; h1/h10/h50 pos=0.0013076746836304/0.0132342269644141/0.1312310993671417, vel=0.0083314701914787/0.058611337095499/0.6320565938949585, rot=0.0026994653754626/0.0395628714570886/0.255790543940226, omega=0.0803192853927612/0.4006314277648926/0.8031769394874573.","timestamp":"2026-06-07T03:30:42.426246+00:00"}
{"delta":0.015426936899999077,"hash":"cef79c32c827e63ec75492d3658ec6676cd01e3f","metric":40.9201092846,"run":5,"short_hash":"cef79c3","status":"discarded","summary":"Experiment #4 discarded: architecture change limited hidden attention to last 16 hidden states in models/models_gru.py, code commit cef79c3, remote 4060. Train/eval suffix attn_win16_cef79c3_bs4096_20260607_113215, checkpoint out/models/raw_gru_random_square_chirp_attn_win16_cef79c3_bs4096_20260607_113215.pt, summary out/predictions/raw_gru_random_square_chirp_attn_win16_cef79c3_bs4096_20260607_113215_model_multistep/melon_summary.csv. Full 500 epoch train completed with best/final valid loss 0.001830; melon_simerr_sum=40.9201092846 vs current best 40.9046823477, so discarded. simerr pos=2.37940526008606, vel=9.141768455505373, rot=5.083130133819283, omega=24.315805435180664; h1/h10/h50 pos=0.0015762856928631/0.0168128143996/0.1067882105708122, vel=0.008620698004961/0.0585253238677978/0.4622268080711365, rot=0.0019373180449724/0.0321769317894006/0.1789848771545279, omega=0.0891521275043487/0.4362410008907318/0.5155603289604187.","timestamp":"2026-06-07T07:38:59.367321+00:00"}
{"delta":-0.020448559900003715,"hash":"15a83d191fd29e0632e8d03a562a952bdabbb642","metric":40.8842337878,"run":6,"short_hash":"15a83d1","status":"kept","summary":"Experiment #5 kept: past-only hidden attention in models/models_gru.py, code commit 15a83d1, remote 4060. Train/eval suffix past_attn_15a83d1_bs4096_20260607_154042, checkpoint out/models/raw_gru_random_square_chirp_past_attn_15a83d1_bs4096_20260607_154042.pt, summary out/predictions/raw_gru_random_square_chirp_past_attn_15a83d1_bs4096_20260607_154042_model_multistep/melon_summary.csv. Full 500 epoch train completed with best/final valid loss 0.001834; melon_simerr_sum=40.8842337878 vs previous best 40.9046823477, so kept. simerr pos=2.38325309753418, vel=9.14198112487793, rot=5.094673469848556, omega=24.26432609558105; h1/h10/h50 pos=0.0015774355269968/0.016820766031742/0.1069630831480026, vel=0.0086254375055432/0.0585304163396358/0.4627940356731415, rot=0.0019502084581517/0.0322645565124104/0.1800003860321329, omega=0.0891269892454147/0.4358792603015899/0.5089624524116516.","timestamp":"2026-06-07T11:38:54.815101+00:00"}
{"delta":0.0745401340999976,"hash":"4bc19b3000f320cdd0b676f0376671753aa6cff7","metric":40.9587739219,"run":7,"short_hash":"4bc19b3","status":"discarded","summary":"Experiment #6 discarded: lowered attention gate init bias from -2.0 to -6.0 on top of kept past-only attention, code commit 4bc19b3, remote 4060. Train/eval suffix gate_m6_4bc19b3_bs4096_20260607_194009, checkpoint out/models/raw_gru_random_square_chirp_gate_m6_4bc19b3_bs4096_20260607_194009.pt, summary out/predictions/raw_gru_random_square_chirp_gate_m6_4bc19b3_bs4096_20260607_194009_model_multistep/melon_summary.csv. Full 500 epoch train completed with best/final valid loss 0.001822; melon_simerr_sum=40.9587739219 vs current best 40.8842337878, so discarded. simerr pos=2.37615704536438, vel=9.140082359313965, rot=5.072171281767897, omega=24.370363235473636; h1/h10/h50 pos=0.0015744873089715/0.0168435703963041/0.1065927222371101, vel=0.0086192563176155/0.0586068220436573/0.4620736241340637, rot=0.001903171070126/0.0319719376356076/0.1790429386052875, omega=0.0894412398338317/0.4374941289424896/0.5177425146102905.","timestamp":"2026-06-07T15:40:19.483997+00:00"}
{"delta":3.1553185213000035,"hash":"6c4b7fe45f19d750650a4ecc9230488f0df1bb88","metric":44.0395523091,"run":8,"short_hash":"6c4b7fe","status":"discarded","summary":"Experiment #7 discarded: parameter-free hidden LayerNorm in models/models_gru.py, code commit 6c4b7fe, remote 4060. Train/eval suffix hln_6c4b7fe_bs4096_20260607_234214, checkpoint out/models/raw_gru_random_square_chirp_hln_6c4b7fe_bs4096_20260607_234214.pt, summary out/predictions/raw_gru_random_square_chirp_hln_6c4b7fe_bs4096_20260607_234214_model_multistep/melon_summary.csv. Full 500 epoch train completed with best/final valid loss 0.001580; melon_simerr_sum=44.0395523091 vs current best 40.8842337878, so discarded. simerr pos=2.2405664920806885, vel=9.553327560424805, rot=4.976691581797523, omega=27.268966674804688; h1/h10/h50 pos=0.0015202048234641/0.0150358080863952/0.1054803878068924, vel=0.0085534323006868/0.0581941530108451/0.4737677872180938, rot=0.0015182424629641/0.0296906407025481/0.1882724701717862, omega=0.1061871871352195/0.4591765403747558/0.6558752059936523.","timestamp":"2026-06-07T19:24:56.405497+00:00"}
{"delta":0.7532000156000009,"hash":"f7b4c0dac92c182a3fec9ea022d66e4cafb732ea","metric":41.6374338034,"run":9,"short_hash":"f7b4c0d","status":"discarded","summary":"Experiment #8 discarded: simplified GRU input by removing explicit hidden state from GRUCell input while keeping past-only hidden attention and residual interface, code commit f7b4c0d, remote 4060. Train/eval suffix gru_xu_f7b4c0d_bs4096_20260608_033010, checkpoint out/models/raw_gru_random_square_chirp_gru_xu_f7b4c0d_bs4096_20260608_033010.pt, summary out/predictions/raw_gru_random_square_chirp_gru_xu_f7b4c0d_bs4096_20260608_033010_model_multistep/melon_summary.csv. Full 500 epoch train completed with best/final valid loss 0.001832; melon_simerr_sum=41.6374338034 vs current best 40.8842337878, so discarded. simerr pos=2.5720107555389404, vel=9.138818740844728, rot=5.242468870018629, omega=24.68413543701172; h1/h10/h50 pos=0.0017841865774244/0.0189557746052742/0.1133100315928459, vel=0.0089776320382952/0.0603024326264858/0.4738235473632812, rot=0.0019869685312332/0.0323990519481484/0.1888164650690471, omega=0.0869570598006248/0.4438754916191101/0.4890081286430359.","timestamp":"2026-06-07T23:27:05.385594+00:00"}
{"delta":-0.11729893950000303,"hash":"0b06cd3210fdcc3780ab05e28bdd047e31cbaa21","metric":40.7669348483,"run":10,"short_hash":"0b06cd3","status":"kept","summary":"Experiment #9 kept: condition residual input on physics next normalized state x_phys_next_norm instead of current x_norm while keeping past-only hidden attention and residual interface unchanged, code commit 0b06cd3, remote 4060. Train/eval suffix physnext_res_0b06cd3_bs4096_20260608_072903, checkpoint out/models/raw_gru_random_square_chirp_physnext_res_0b06cd3_bs4096_20260608_072903.pt, summary out/predictions/raw_gru_random_square_chirp_physnext_res_0b06cd3_bs4096_20260608_072903_model_multistep/melon_summary.csv. Full 500 epoch train completed with best/final valid loss 0.001834; melon_simerr_sum=40.7669348483 vs previous best 40.8842337878, so kept. simerr pos=2.380279302597046, vel=9.120034217834473, rot=5.084356999913874, omega=24.18226432800293; h1/h10/h50 pos=0.0015760759124532/0.0168038047850132/0.1067163348197937, vel=0.0086321514099836/0.0586758106946945/0.461045503616333, rot=0.0019495219283467/0.0322910386600157/0.1792825517584867, omega=0.0888089910149574/0.43536376953125/0.5064030289649963.","timestamp":"2026-06-08T03:33:15.447698+00:00"}
{"delta":0.00007207149999999274,"hash":"7ccc2ab1569d6b1a8e24fa5a8dd1894114d7ac63","metric":40.7670069198,"run":11,"short_hash":"7ccc2ab","status":"discarded","summary":"Experiment #10 discarded: code commit 7ccc2ab conditions hidden attention query on x_phys_next_norm instead of x_norm, on top of kept experiment #9, remote 4060. Full 500 epoch train/eval suffix physnext_attn_7ccc2ab_bs4096_20260608_113433; checkpoint out/models/raw_gru_random_square_chirp_physnext_attn_7ccc2ab_bs4096_20260608_113433.pt; summary out/predictions/raw_gru_random_square_chirp_physnext_attn_7ccc2ab_bs4096_20260608_113433_model_multistep/melon_summary.csv. melon_simerr_sum=40.7670069198 vs current best 40.7669348483, so discarded. simerr pos=2.3802740573883057, vel=9.120050430297852, rot=5.084376142474868, omega=24.18230628967285; h1/h10/h50 pos=0.0015760670648887/0.0168037731200456/0.1067160964012146, vel=0.0086321169510483/0.0586757101118564/0.4610469043254852, rot=0.0019495050413736/0.032290997682182/0.1792832033708565, omega=0.0888087972998619/0.435364305973053/0.5064029097557068.","timestamp":"2026-06-08T08:33:46.035402+00:00"}
